course,target,label
"Code Review, ChatGPT, Software Engineering, Machine Learning, Software Design Patterns, Technical Documentation, Software Architecture, Database Design, System Design and Implementation, Large Language Modeling, Prompt Engineering, Collaborative Software","Network Architecture and Topology, Network Protocols and Communications; OSI and TCP/IP Layer; Physical Layer, Data Link Layer, Ethernet Switching; Transport Layer, Application Layer; IPv4 Addressing; IPv6 Addressing; Subnetting; VLANs and Inter-VLAN Routing; EtherChannel; FHRP; DHCPv4; DHCPv6; LAN Security; Wireless LAN; Static Protocol Routing",0
"Serve page, Node.js, Date Amount/Export, Cloud Computing Architecture, Full-Stack Web Development, Software Architecture, Flask (Web Framework), Responsive Web Design, Engineering Software, Prompt Engineering, Cloud Computing, Application Deployment",Introduction to Blockchain; Cryptography Basics; Consensus Algorithms; Smart Contracts; Cryptocurrency; Blockchain Applications in Industry,0
"Front-end Web Development, Web Development Tools, Animations, JavaScript, Full-Stack Web Development, Digital Assets, User interface (UI) design, User interface (UI), Bootstrap (front-end framework), Software Development Tools, Computer Programming Tools, Web Applications",Introduction to Databases; Data Models; Entity-Relationship Model; Relational Model; SQL Basics; Advanced SQL; Database Normalization; Database Design; Transactions and Concurrency Control; Database Security,0
"Network Architecture, Network Protocols, Computer Networking, Virtualization, General Networking, Scalability, Network Security, Hardware Architecture, Software-Defined Networking, Network Administration, Network Routing","Network Architecture and Topology, Network Protocols and Communications; OSI and TCP/IP Layer; Physical Layer, Data Link Layer, Ethernet Switching; Transport Layer, Application Layer; IPv4 Addressing; IPv6 Addressing; Subnetting; VLANs and Inter-VLAN Routing; EtherChannel; FHRP; DHCPv4; DHCPv6; LAN Security; Wireless LAN; Static Protocol Routing",1
"Front-end Web Development, Full-Stack Web Development, Database Design, SQL, Github, Cloud Hosting, Bootstrap (front-end framework), Database Management Systems, Version Control, Web design and development, Unix Commands, Data Structures","Network Architecture and Topology, Network Protocols and Communications; OSI and TCP/IP Layer; Physical Layer, Data Link Layer, Ethernet Switching; Transport Layer, Application Layer; IPv4 Addressing; IPv6 Addressing; Subnetting; VLANs and Inter-VLAN Routing; EtherChannel; FHRP; DHCPv4; DHCPv6; LAN Security; Wireless LAN; Static Protocol Routing",1
"Front-end Web Development, Web Development Tools, Animations, JavaScript, Full-Stack Web Development, Digital Assets, User interface (UI) design, User interface (UI), Bootstrap (front-end framework), Software Development Tools, Computer Programming Tools, Web Applications",Introduction to machine learning and artificial intelligence; Regression; Clustering; Non-ANN classifiers; ANN classifiers; Back-propagation algorithms; PCA for data reduction; Deep learning; ANN-based recognition system design,0
"MLOps (Machine Learning Operations), Generative AI, Natural Language Processing, Artificial Intelligence and Machine Learning (AI/ML), Cloud Platforms, Prompt Engineering, Application Programming Interface (API), Google Cloud Platform, Cloud infrastructure, Large Language Modeling, Machine Learning","Network Architecture and Topology, Network Protocols and Communications; OSI and TCP/IP Layer; Physical Layer, Data Link Layer, Ethernet Switching; Transport Layer, Application Layer; IPv4 Addressing; IPv6 Addressing; Subnetting; VLANs and Inter-VLAN Routing; EtherChannel; FHRP; DHCPv4; DHCPv6; LAN Security; Wireless LAN; Static Protocol Routing",0
"Malware Protection, Intrusion Detection and Prevention, Endpoint Security, Cyber Security Assessment, TCP/IP, Incident Response, Cybersecurity, Cloud Computing, Identity and Access Management, Computer Security Incident Management, Networking hardware, Interview Skills",Introduction to Blockchain; Cryptography Basics; Consensus Algorithms; Smart Contracts; Cryptocurrency; Blockchain Applications in Industry,0
"Front-end Web Development, Communication, Responsive Web Design, Database Design, HTML and CSS, Databases, SQL, Database Administration, Pseudocode, Bootstrap (Front-end Framework), Database Management Systems, Unit Testing",Data Security and Integrity; Vulnerabilities; Resource Protection; Private & Public Key Cryptography; Authentication; Network and Web Security;,0
"Database Theory, Theoretical Computer Science, Apache Cassandra, Distributed Computing, Operating systems, Algorithms, Data Storage Technologies, Apache Hadoop, C ++ (Programming Language), Systems design, Scalability, Cloud Computing, Nosql, Network Protocols",Introduction to machine learning and artificial intelligence; Regression; Clustering; Non-ANN classifiers; ANN classifiers; Back-propagation algorithms; PCA for data reduction; Deep learning; ANN-based recognition system design,0
"Network Architecture, Network Protocols, Computer Networking, Virtualization, General Networking, Scalability, Network Security, Hardware Architecture, Software-Defined Networking, Network Administration, Network Routing",Introduction to machine learning and artificial intelligence; Regression; Clustering; Non-ANN classifiers; ANN classifiers; Back-propagation algorithms; PCA for data reduction; Deep learning; ANN-based recognition system design,0
"Fintech, Investments, Digital Assets, Distributed Computing, Blockchain, Governance, Emerging technology, Public Administration, Cryptography, Legor, Internet Of Things","Introduction to cloud computing concepts; Introduction to Virtualization, Hypervisor, Container; IaaS, PaaS and SaaS Service Models; Introduction to Azure, GCS, and AWS platforms; Introduction for scalability and reliability features; Virtualization, Hypervisor, Container; Open source applications for cloud computing platforms",0
"Technical Support, IT Automation, Linux Commands, Software Architecture, Customer Relationship Management, Infrastructure as code (IAC), Cloud Computing, Amazon CloudWatch, Root Cause Analysis, AWS CloudFormation, Network Troubleshooting, Command-Line Interface","Introduction to cloud computing concepts; Introduction to Virtualization, Hypervisor, Container; IaaS, PaaS and SaaS Service Models; Introduction to Azure, GCS, and AWS platforms; Introduction for scalability and reliability features; Virtualization, Hypervisor, Container; Open source applications for cloud computing platforms",1
"Data Security, Cyber Attacks, Infrastructure Security, Governance, Authorization (Computing), Computer Security Awareness Training, Incident Response, Cybersecurity, Computer Security Incident Management, Risk Management Framework, Disaster Recovery, Role-Based Access Control (RBAC)",Introduction to machine learning and artificial intelligence; Regression; Clustering; Non-ANN classifiers; ANN classifiers; Back-propagation algorithms; PCA for data reduction; Deep learning; ANN-based recognition system design,0
"General Data Protection Regulation (GDPR), Data Security, Contract Review, Tax Laws, Tax Compliance, Cybersecurity, Cloud Computing, Vendor Contracts, Contract Negotiation, Data Governance, Regulation and Legal Compliance, Tate",Introduction to Blockchain; Cryptography Basics; Consensus Algorithms; Smart Contracts; Cryptocurrency; Blockchain Applications in Industry,0
"Cloud Services, Cloud Hosting, Cloud Computing, Hybrid Cloud Computing, Cloud infrastructure, Infrastructure as a service (Iaas), Serverless Computing, Cloud Technologies, DevOps, Cloud Computing Architecture, Cloud Development, Cloud Solutions, Cloud Platforms, Cloud Engineering, Cloud Storage, Cloud Security, Emerging technology, Cloud Management, Virtual machines, Cloud-Native Computing",Introduction to machine learning and artificial intelligence; Regression; Clustering; Non-ANN classifiers; ANN classifiers; Back-propagation algorithms; PCA for data reduction; Deep learning; ANN-based recognition system design,0
"Artificial Intelligence, Cybersecurity, Business strategy, Blockchain, Business technology, Digital Transformation, Internet Of Things, Technology Strategies, Emerging technology, Digital Marketing, Real time data, Cloud Computing, E-Commerce",Introduction to Databases; Data Models; Entity-Relationship Model; Relational Model; SQL Basics; Advanced SQL; Database Normalization; Database Design; Transactions and Concurrency Control; Database Security,0
"Social skills, Business Communication, English Language, Vocabulary, Writing, Business Writing, Interview Skills, Communication, Business Correspondence, Professional Networking, Verbal Communication Skills",Introduction to Blockchain; Cryptography Basics; Consensus Algorithms; Smart Contracts; Cryptocurrency; Blockchain Applications in Industry,0
"Electronic Medical Record, Clinical Data Management, Applied Machine Learning, Machine Learning, Unstructured Data, Health Systems, Health Technology, Feature Engineering, Clinical Research, Pharmaceuticals, Artificial Intelligence, Data mining","Introduction to cloud computing concepts; Introduction to Virtualization, Hypervisor, Container; IaaS, PaaS and SaaS Service Models; Introduction to Azure, GCS, and AWS platforms; Introduction for scalability and reliability features; Virtualization, Hypervisor, Container; Open source applications for cloud computing platforms",0
"Software Architecture, Responsive Web Design, Database Design, Containerization, Engineering Software, Prompt Engineering, Cloud-Native Computing, Github, Database Management, CI/CD, Software Development Life Cycle, Version Control",Introduction to machine learning and artificial intelligence; Regression; Clustering; Non-ANN classifiers; ANN classifiers; Back-propagation algorithms; PCA for data reduction; Deep learning; ANN-based recognition system design,0
"Data Security, Cyber Attacks, Infrastructure Security, Governance, Authorization (Computing), Computer Security Awareness Training, Incident Response, Cybersecurity, Computer Security Incident Management, Risk Management Framework, Disaster Recovery, Role-Based Access Control (RBAC)","Network Architecture and Topology, Network Protocols and Communications; OSI and TCP/IP Layer; Physical Layer, Data Link Layer, Ethernet Switching; Transport Layer, Application Layer; IPv4 Addressing; IPv6 Addressing; Subnetting; VLANs and Inter-VLAN Routing; EtherChannel; FHRP; DHCPv4; DHCPv6; LAN Security; Wireless LAN; Static Protocol Routing",0
"Platform As A Service (PaaS), Cloud Services, Cloud Computing, Public Cloud, Infrastructure as a service (Iaas), Cloud Hosting, Software As A Service, Private cloud, Serverless Computing, Hybrid Cloud Computing, Microsoft Azure, Cloud Platforms, Cloud Solutions, Computing Platforms, Virtual machines, Cloud infrastructure, Cloud Computing Architecture, Cloud Technologies, It infrastructure, Managed Services",Introduction to machine learning and artificial intelligence; Regression; Clustering; Non-ANN classifiers; ANN classifiers; Back-propagation algorithms; PCA for data reduction; Deep learning; ANN-based recognition system design,0
"Database Management, Databases, Database Systems, Data manipulation, IBM DB2, SQL, Data analysis, Relational Databases, Microsoft SQL Servers, Transaction Processing, Stored Procedure, Query Languages, Mysql","Introduction to cloud computing concepts; Introduction to Virtualization, Hypervisor, Container; IaaS, PaaS and SaaS Service Models; Introduction to Azure, GCS, and AWS platforms; Introduction for scalability and reliability features; Virtualization, Hypervisor, Container; Open source applications for cloud computing platforms",0
"Data Security, Digital Transformation, Real time data, Cloud infrastructure, Cloud Management, Cloud Computing, Data management, Serverless Computing, Big data, Artificial Intelligence, Tensorflow, Data Governance",Introduction to machine learning and artificial intelligence; Regression; Clustering; Non-ANN classifiers; ANN classifiers; Back-propagation algorithms; PCA for data reduction; Deep learning; ANN-based recognition system design,0
"General Data Protection Regulation (GDPR), Unsupervised Learning, Applied Machine Learning, Human Centered Design, Machine Learning, Computer Science, Research, Machine Learning Algorithms, Deep Learning, Reinforcement Learning, Artificial Intelligence, Information Technology Architecture",Data Security and Integrity; Vulnerabilities; Resource Protection; Private & Public Key Cryptography; Authentication; Network and Web Security;,0
"Cloud Storage, API Gateway, Cloud Computing Architecture, Software Architecture, Amazon elastic compute clouds, Cloud Computing, Amazon CloudWatch, Serverless Computing, Amazon S3, Data Architecture, Data Visualization, Event-driven programming",Data Security and Integrity; Vulnerabilities; Resource Protection; Private & Public Key Cryptography; Authentication; Network and Web Security;,0
"Data Security, Key management, Information Systems Security, Cybersecurity, Data management, Vulnerability Assessments, Application Security, Digital Assets, Disaster Recovery, Security Management, Regulatory Compliance, Network Security","Introduction to cloud computing concepts; Introduction to Virtualization, Hypervisor, Container; IaaS, PaaS and SaaS Service Models; Introduction to Azure, GCS, and AWS platforms; Introduction for scalability and reliability features; Virtualization, Hypervisor, Container; Open source applications for cloud computing platforms",0
"Cloud Storage, Database Architecture and Administration, Cloud Computing Architecture, Cloud infrastructure, Containerization, Prompt Engineering, Identity and Access Management, Data Migration, Database Administration, Application Deployment, Database Management, Generative AI",Introduction to Blockchain; Cryptography Basics; Consensus Algorithms; Smart Contracts; Cryptocurrency; Blockchain Applications in Industry,0
"Linux Commands, Responsive Web Design, Database Design, HTML and CSS, SQL, Github, Bootstrap (front-end framework), Database Management Systems, Version Control, Unix Commands, React.js, API design","Network Architecture and Topology, Network Protocols and Communications; OSI and TCP/IP Layer; Physical Layer, Data Link Layer, Ethernet Switching; Transport Layer, Application Layer; IPv4 Addressing; IPv6 Addressing; Subnetting; VLANs and Inter-VLAN Routing; EtherChannel; FHRP; DHCPv4; DHCPv6; LAN Security; Wireless LAN; Static Protocol Routing",0
"Applicant Tracking Systems, Tableau Software, Database Design, Pipelines data, Integrity data, Professional Development, SQL, Business Intelligence, Interview Skills, Interactive data viewing, Stakeholder Engagement, Data Visualization","Network Architecture and Topology, Network Protocols and Communications; OSI and TCP/IP Layer; Physical Layer, Data Link Layer, Ethernet Switching; Transport Layer, Application Layer; IPv4 Addressing; IPv6 Addressing; Subnetting; VLANs and Inter-VLAN Routing; EtherChannel; FHRP; DHCPv4; DHCPv6; LAN Security; Wireless LAN; Static Protocol Routing",0
"ChatGPT, Database Architecture and Administration, Database Design, Large Language Modeling, Prompt Engineering, Productivity, Automation, Data Migration, SQL, Technical Design, Software Documentation, Database Management","Network Architecture and Topology, Network Protocols and Communications; OSI and TCP/IP Layer; Physical Layer, Data Link Layer, Ethernet Switching; Transport Layer, Application Layer; IPv4 Addressing; IPv6 Addressing; Subnetting; VLANs and Inter-VLAN Routing; EtherChannel; FHRP; DHCPv4; DHCPv6; LAN Security; Wireless LAN; Static Protocol Routing",0
"Encryption, Payment Systems, Data mining, Scripting, Cryptography, Distributed Computing, Network Protocols, Blockchain, Public Affairs, Emerging technology, Transaction Processing, Data Storage, Fintech, Digital Assets, Market Dynamics, Application Security","Introduction to cloud computing concepts; Introduction to Virtualization, Hypervisor, Container; IaaS, PaaS and SaaS Service Models; Introduction to Azure, GCS, and AWS platforms; Introduction for scalability and reliability features; Virtualization, Hypervisor, Container; Open source applications for cloud computing platforms",0
"Computer Architecture, Systems Architecture, Microarchitecture, Performance Tuning, Hardware Architecture, Computer Engineering, Scalability, Operating systems, Distributed Computing, Computer Science",Introduction to Blockchain; Cryptography Basics; Consensus Algorithms; Smart Contracts; Cryptocurrency; Blockchain Applications in Industry,0
"Applied Machine Learning, Machine Learning Methods, Engineering analysis, Image Analysis, Ui components, Programming Principles, Statistical Methods, Scripting, Mathematical Software, User interface (UI), Matlab, Engineering Calculations",Introduction to Databases; Data Models; Entity-Relationship Model; Relational Model; SQL Basics; Advanced SQL; Database Normalization; Database Design; Transactions and Concurrency Control; Database Security,0
"Cloud Services, Data Security, Infrastructure Security, Cloud Technologies, Information Technology, Cloud Computing Architecture, Cloud Applications, Configuration Management, IT Security Architecture, Data management, Risk Management Framework, Computer Science, Cloud infrastructure, Cloud Security, Cloud Computing, Cybersecurity, Encryption, Cloud Platforms, Application Security",Introduction to Blockchain; Cryptography Basics; Consensus Algorithms; Smart Contracts; Cryptocurrency; Blockchain Applications in Industry,0
"Routing Protocols, System Programming, Network Routing, TCP/IP, Telecommunications, Digital Communications, Integrity data, Network Infrastructure, Network Planning And Design, Network Performance Management, Network Security, Wireless Networks",Introduction to Blockchain; Cryptography Basics; Consensus Algorithms; Smart Contracts; Cryptocurrency; Blockchain Applications in Industry,0
"Software Engineering, Date Amount/Export, Cloud Computing Architecture, Continuous Integration, Linux Commands, User Story, Flask (Web Framework), Gherkin (Scripting Language), Test Driven Development (TDD), Open Web Application Security Project (OWASP), Application Deployment, Jenkins","Network Architecture and Topology, Network Protocols and Communications; OSI and TCP/IP Layer; Physical Layer, Data Link Layer, Ethernet Switching; Transport Layer, Application Layer; IPv4 Addressing; IPv6 Addressing; Subnetting; VLANs and Inter-VLAN Routing; EtherChannel; FHRP; DHCPv4; DHCPv6; LAN Security; Wireless LAN; Static Protocol Routing",1
"Data Security, Security Engineering, Computer Security, Cyber Security Assessment, Key management, Information Systems Security, Cybersecurity, Vulnerability Assessments, Application Security, Solution Design, Network Security, Secure Coding",Data Security and Integrity; Vulnerabilities; Resource Protection; Private & Public Key Cryptography; Authentication; Network and Web Security;,0
"Remote Access Systems, OSI Models, Network Security, Network Routers, Network Infrastructure, General Networking, Network Protocols, Dynamic Host Configuration Protocol (DHCP), Intrusion Detection and Prevention, TCP/IP, Network Routing, Virtual Private Networks (VPN), Network model, Wireless Networks, Computer Networking, Routing Protocols, Network Troubleshooting, Networking hardware, Network Architecture, Network Administration",Introduction to Blockchain; Cryptography Basics; Consensus Algorithms; Smart Contracts; Cryptocurrency; Blockchain Applications in Industry,0
"Artificial Intelligence, Cybersecurity, Business strategy, Blockchain, Business technology, Digital Transformation, Internet Of Things, Technology Strategies, Emerging technology, Digital Marketing, Real time data, Cloud Computing, E-Commerce","Introduction to cloud computing concepts; Introduction to Virtualization, Hypervisor, Container; IaaS, PaaS and SaaS Service Models; Introduction to Azure, GCS, and AWS platforms; Introduction for scalability and reliability features; Virtualization, Hypervisor, Container; Open source applications for cloud computing platforms",0
"Data Security, Data Literacy, Database Design, Excel formas, Databases, Data management, Data Migration, SQL, Date store, Business Intelligence, Data Architecture, Data Visualization",Introduction to Blockchain; Cryptography Basics; Consensus Algorithms; Smart Contracts; Cryptocurrency; Blockchain Applications in Industry,0
"Date Amount/Export, Database Design, Data Pipelines, Programming Principles, Databases, SQL, Date store, Date Architecture, Big data, Database Management Systems, IBM DB2, Data Governance",Introduction to machine learning and artificial intelligence; Regression; Clustering; Non-ANN classifiers; ANN classifiers; Back-propagation algorithms; PCA for data reduction; Deep learning; ANN-based recognition system design,0
"IBM Cognos Analytics, Date Amount/Export, Excel formas, SQL, Generative AI, Interactive data viewing, Big data, Data Visualization, Data wrangling, Exploratory Data Analysis, Dashboard, Plotly",Introduction to Databases; Data Models; Entity-Relationship Model; Relational Model; SQL Basics; Advanced SQL; Database Normalization; Database Design; Transactions and Concurrency Control; Database Security,0
"Fintech, Cryptographic Protocols, Blockchain, Financial Services, Emerging technology, Scalability, Payment Systems, Financial Regulation, Cryptography, Technology Strategies, Distributed Computing, Digital Assets, Encryption, Innovation, Regulatory Compliance",Introduction to machine learning and artificial intelligence; Regression; Clustering; Non-ANN classifiers; ANN classifiers; Back-propagation algorithms; PCA for data reduction; Deep learning; ANN-based recognition system design,0
"Database Design, Database Administration, Query Languages, Mysql, Databases, Database Management Systems, SQL, NoSQL, Relational Databases",Introduction to machine learning and artificial intelligence; Regression; Clustering; Non-ANN classifiers; ANN classifiers; Back-propagation algorithms; PCA for data reduction; Deep learning; ANN-based recognition system design,0
"Software Design Patterns, Software Engineering, Software Development Tools, Systems Development, Programming Principles, Agile methodology, Software Documentation, Development Environment, Unified Modeling Language, Engineering Software, Software Development Methodologies, Integrated Development Environment, Software Development Life Cycle, Program Development, Software Design, Software Architecture, Python Programming, Application Development",Introduction to Blockchain; Cryptography Basics; Consensus Algorithms; Smart Contracts; Cryptocurrency; Blockchain Applications in Industry,0
"Data Security, Intrusion Detection and Prevention, Cyber Attacks, Cloud Storage, Continuous Monitoring, Large Language Modeling, Cybersecurity, Identity and Access Management, Computer Security Incident Management, DevseCops, Cyber Operations, Risk Management Framework",Data Security and Integrity; Vulnerabilities; Resource Protection; Private & Public Key Cryptography; Authentication; Network and Web Security;,1
"Computer Networking, Network Architecture, Digital Communications, Network Protocols, Network Routing, Network Planning And Design, OSI Models, System Programming, Integrity data, TCP/IP",Introduction to Databases; Data Models; Entity-Relationship Model; Relational Model; SQL Basics; Advanced SQL; Database Normalization; Database Design; Transactions and Concurrency Control; Database Security,0
"Network Protocols, Endpoint Security, Zero Trust Network Access, Firewall, General Networking, Public Key Infrastructure, Network Infrastructure, Network Security, Encryption, Cryptography, Cybersecurity, TCP/IP","Network Architecture and Topology, Network Protocols and Communications; OSI and TCP/IP Layer; Physical Layer, Data Link Layer, Ethernet Switching; Transport Layer, Application Layer; IPv4 Addressing; IPv6 Addressing; Subnetting; VLANs and Inter-VLAN Routing; EtherChannel; FHRP; DHCPv4; DHCPv6; LAN Security; Wireless LAN; Static Protocol Routing",0
"Entrepreneurial Finance, Business Valuation, Investments, Excel formulas, Financial modeling, Financial Analysis, Financial Market, Entrepreneurship, Market data, Probability Distribution, Cryptography, Microsoft Excel",Introduction to Databases; Data Models; Entity-Relationship Model; Relational Model; SQL Basics; Advanced SQL; Database Normalization; Database Design; Transactions and Concurrency Control; Database Security,0
"Network Protocols, Networking hardware, Cloud Services, TCP/IP, General Networking, Microsoft Windows, Cloud Storage, Local Area Networks, Computer Networking, Command-Line Interface, Wireless Networks, Data Storage, Network Administration, Network Infrastructure, Network Troubleshooting, Data Storage Technologies, Network Architecture",Data Security and Integrity; Vulnerabilities; Resource Protection; Private & Public Key Cryptography; Authentication; Network and Web Security;,0
"ChatGPT, Software Engineering, Machine Learning, Date Amount/Export, Software Architecture, Flask (Web Framework), Responsive Web Design, Engineering Software, Large Language Modeling, Prompt Engineering, Generative AI, Software Development Tools",Introduction to Blockchain; Cryptography Basics; Consensus Algorithms; Smart Contracts; Cryptocurrency; Blockchain Applications in Industry,0
