course,target,label
"Computer Networking, Network Architecture, Digital Communications, Network Protocols, Network Routing, Network Planning And Design, OSI Models, System Programming, Integrity data, TCP/IP","Network Architecture and Topology, Network Protocols and Communications; OSI and TCP/IP Layer; Physical Layer, Data Link Layer, Ethernet Switching; Transport Layer, Application Layer; IPv4 Addressing; IPv6 Addressing; Subnetting; VLANs and Inter-VLAN Routing; EtherChannel; FHRP; DHCPv4; DHCPv6; LAN Security; Wireless LAN; Static Protocol Routing",1
"Network Architecture, Network Protocols, Computer Networking, Virtualization, General Networking, Scalability, Network Security, Hardware Architecture, Software-Defined Networking, Network Administration, Network Routing",Data Security and Integrity; Vulnerabilities; Resource Protection; Private & Public Key Cryptography; Authentication; Network and Web Security;,0
"Unsupervised Learning, Applied Machine Learning, Machine Learning Methods, Machine Learning, Random Forest Algorithm, Feature Engineering, Classification And Regression Tree (CART), Machine Learning Algorithms, Jupyter, Deep Learning, Predictive Modeling, Reinforcement Learning",Introduction to machine learning and artificial intelligence; Regression; Clustering; Non-ANN classifiers; ANN classifiers; Back-propagation algorithms; PCA for data reduction; Deep learning; ANN-based recognition system design,1
"Server side, Node.js, Date Amount/Export, Cloud Computing Architecture, Full-Stack Web Development, Software Architecture, Flask (Web Framework), Responsive Web Design, Engineering Software, Prompt Engineering, Cloud Computing, Application Deployment",Introduction to machine learning and artificial intelligence; Regression; Clustering; Non-ANN classifiers; ANN classifiers; Back-propagation algorithms; PCA for data reduction; Deep learning; ANN-based recognition system design,0
"Network Protocols, Network Analysis, Cybersecurity, Open Shortest Path First (OSPF), Network Architecture, Dynamic Host Configuration Protocol (DHCP), Network Security, General Networking, File Transfer Protocol (FTP), TCP/IP, Intrusion Detection and Prevention, System Configuration, Network Routing","Introduction to cloud computing concepts; Introduction to Virtualization, Hypervisor, Container; IaaS, PaaS and SaaS Service Models; Introduction to Azure, GCS, and AWS platforms; Introduction for scalability and reliability features; Virtualization, Hypervisor, Container; Open source applications for cloud computing platforms",0
"Capital Markets, Investments, Banking Services, Asset Management, Investment management, Point of Sale, Wealth Management, Payment Systems, Credit/Debit Card Processing, Mobile Banking, Credit Risk, Market Dynamics","Introduction to cloud computing concepts; Introduction to Virtualization, Hypervisor, Container; IaaS, PaaS and SaaS Service Models; Introduction to Azure, GCS, and AWS platforms; Introduction for scalability and reliability features; Virtualization, Hypervisor, Container; Open source applications for cloud computing platforms",0
"User Accounts, Database Management, Database Architecture and Administration, Mysql, Database Administration, Operational Databases, Database Systems, Performance Tuning, Database Design, PostgreSQL, Encryption, Role-Based Access Control (RBAC), Data Storage Technologies, Relational Databases, System Monitoring, Disaster Recovery, IBM DB2",Data Security and Integrity; Vulnerabilities; Resource Protection; Private & Public Key Cryptography; Authentication; Network and Web Security;,0
"Workflow Management, MLOps (Machine Learning Operations), Unsupervised Learning, Goal Setting, Applied Machine Learning, Data Collection, Linear algebra, Random Forest Algorithm, Productivity, Learning Strategies, Regression Analysis, Machine Learning Algorithms",Introduction to machine learning and artificial intelligence; Regression; Clustering; Non-ANN classifiers; ANN classifiers; Back-propagation algorithms; PCA for data reduction; Deep learning; ANN-based recognition system design,1
"Cloud Computing Architecture, Governance, Incident Response, Cybersecurity, Application Security, Computer Security Incident Management, Network Troubleshooting, Disaster Recovery, Network Security, Penetration Testing, Virtualization, Information Technology","Network Architecture and Topology, Network Protocols and Communications; OSI and TCP/IP Layer; Physical Layer, Data Link Layer, Ethernet Switching; Transport Layer, Application Layer; IPv4 Addressing; IPv6 Addressing; Subnetting; VLANs and Inter-VLAN Routing; EtherChannel; FHRP; DHCPv4; DHCPv6; LAN Security; Wireless LAN; Static Protocol Routing",0
"Intrusion Detection and Prevention, Cyber Attacks, Incident Response, Cybersecurity, Vulnerability Assessments, Computer Security Incident Management, SQL, Interview Skills, Harding, Bash (Scripting Language), Network Security, Threat Management",Introduction to machine learning and artificial intelligence; Regression; Clustering; Non-ANN classifiers; ANN classifiers; Back-propagation algorithms; PCA for data reduction; Deep learning; ANN-based recognition system design,1
"MLOps (Machine Learning Operations), Unsupervised Learning, Applied Machine Learning, Infrastructure architecture, Cloud infrastructure, Generative AI Agents, Large Language Modeling, Prompt Engineering, Data management, Microsoft Azure, Application Deployment, Generative AI",Introduction to Blockchain; Cryptography Basics; Consensus Algorithms; Smart Contracts; Cryptocurrency; Blockchain Applications in Industry,1
"Ethical Standards And Conduct, Computational Thinking, Algorithms, Data quality, Design Thinking, Computer Science, Creativity, Machine Learning, Artificial Intelligence",Introduction to machine learning and artificial intelligence; Regression; Clustering; Non-ANN classifiers; ANN classifiers; Back-propagation algorithms; PCA for data reduction; Deep learning; ANN-based recognition system design,1
"Probability & Statistics, Supervised Learning, Decision Tree Learning, Machine Learning Algorithms, Decision Support Systems, Complex Problem Solving, Text Mining, Artificial Intelligence and Machine Learning (AI/ML), Artificial Intelligence, Bayesian Statistics, Information Architecture, Machine Learning, Natural Language Processing, Taxonomy, Business strategy, Game Design, Strategic Thinking, Algorithms, Computational Logic, Strategic Decision-Making","Network Architecture and Topology, Network Protocols and Communications; OSI and TCP/IP Layer; Physical Layer, Data Link Layer, Ethernet Switching; Transport Layer, Application Layer; IPv4 Addressing; IPv6 Addressing; Subnetting; VLANs and Inter-VLAN Routing; EtherChannel; FHRP; DHCPv4; DHCPv6; LAN Security; Wireless LAN; Static Protocol Routing",0
"Applied Machine Learning, Machine Learning Methods, Engineering analysis, Image Analysis, Ui components, Programming Principles, Statistical Methods, Scripting, Mathematical Software, User interface (UI), Matlab, Engineering Calculations",Introduction to Blockchain; Cryptography Basics; Consensus Algorithms; Smart Contracts; Cryptocurrency; Blockchain Applications in Industry,0
"Front-end Web Development, Full-Stack Web Development, Database Design, SQL, Github, Cloud Hosting, Bootstrap (front-end framework), Database Management Systems, Version Control, Web design and development, Unix Commands, Data Structures","Introduction to cloud computing concepts; Introduction to Virtualization, Hypervisor, Container; IaaS, PaaS and SaaS Service Models; Introduction to Azure, GCS, and AWS platforms; Introduction for scalability and reliability features; Virtualization, Hypervisor, Container; Open source applications for cloud computing platforms",0
"Amazon elastic compute clouds, Internet Of Things, Network Architecture, Emerging technology, Infrastructure As A Service (IaaS), Telecommunications, Wireless Networks, Software As A Service, Cloud Computing, Cloud Services, General Networking, Amazon Web Services, Network Protocols, Cloud Computing Architecture, Real time date",Introduction to Blockchain; Cryptography Basics; Consensus Algorithms; Smart Contracts; Cryptocurrency; Blockchain Applications in Industry,0
"Encryption, Threat Detection, Cloud Security, Public Key Infrastructure, Wireless Networks, Network Monitoring, Cyber Security Policies, Security Controls, Intrusion Detection and Prevention, Network Security, Authorization (Computing), Data Security, Cybersecurity, Information Assurance, Cryptography, Internet Of Things, Mobile Security, Identity and Access Management","Network Architecture and Topology, Network Protocols and Communications; OSI and TCP/IP Layer; Physical Layer, Data Link Layer, Ethernet Switching; Transport Layer, Application Layer; IPv4 Addressing; IPv6 Addressing; Subnetting; VLANs and Inter-VLAN Routing; EtherChannel; FHRP; DHCPv4; DHCPv6; LAN Security; Wireless LAN; Static Protocol Routing",0
"IBM Cognos Analytics, Date Amount/Export, Linux Commands, Database Design, SQL, Date store, Database Administration, Generative AI, Apache Spark, Apache Hadoop, NoSQL, Data Warehousing",Introduction to Databases; Data Models; Entity-Relationship Model; Relational Model; SQL Basics; Advanced SQL; Database Normalization; Database Design; Transactions and Concurrency Control; Database Security,0
"Remote Access Systems, OSI Models, Network Security, Network Routers, Network Infrastructure, General Networking, Network Protocols, Dynamic Host Configuration Protocol (DHCP), Intrusion Detection and Prevention, TCP/IP, Network Routing, Virtual Private Networks (VPN), Network model, Wireless Networks, Computer Networking, Routing Protocols, Network Troubleshooting, Networking hardware, Network Architecture, Network Administration",Data Security and Integrity; Vulnerabilities; Resource Protection; Private & Public Key Cryptography; Authentication; Network and Web Security;,0
"Applied Machine Learning, Machine Learning Methods, Engineering analysis, Image Analysis, Ui components, Programming Principles, Statistical Methods, Scripting, Mathematical Software, User interface (UI), Matlab, Engineering Calculations","Network Architecture and Topology, Network Protocols and Communications; OSI and TCP/IP Layer; Physical Layer, Data Link Layer, Ethernet Switching; Transport Layer, Application Layer; IPv4 Addressing; IPv6 Addressing; Subnetting; VLANs and Inter-VLAN Routing; EtherChannel; FHRP; DHCPv4; DHCPv6; LAN Security; Wireless LAN; Static Protocol Routing",1
"Computer Science, Object Oriented Programming (OOP), Data Structures, Debugging, Programming Principles, Performance Tuning, Animations, Computer Programming, Algorithms, Computational Thinking, Program Development, Java programming, Java",Introduction to Databases; Data Models; Entity-Relationship Model; Relational Model; SQL Basics; Advanced SQL; Database Normalization; Database Design; Transactions and Concurrency Control; Database Security,0
"Microservices, Cloud Storage, Safety Culture, Cloud infrastructure, Cloud Management, Containerization, Service Level Agreement, Prompt Engineering, Identity and Access Management, System Monitoring, Application Deployment, Application Performance Management",Data Security and Integrity; Vulnerabilities; Resource Protection; Private & Public Key Cryptography; Authentication; Network and Web Security;,0
"Graphic Design, Logo Design, Creative Design, CAMPAIGN MANAGEMENT, Digital design, Content Creation, Social Media Content, Content Marketing, Visual Design, Content Strategy, Advertising, Generative AI","Network Architecture and Topology, Network Protocols and Communications; OSI and TCP/IP Layer; Physical Layer, Data Link Layer, Ethernet Switching; Transport Layer, Application Layer; IPv4 Addressing; IPv6 Addressing; Subnetting; VLANs and Inter-VLAN Routing; EtherChannel; FHRP; DHCPv4; DHCPv6; LAN Security; Wireless LAN; Static Protocol Routing",0
"MLOps (Machine Learning Operations), Software Engineering, Applied Machine Learning, Cloud Storage, Machine Learning, Cloud infrastructure, Distributed Computing, Cloud Computing, Cloud-Native Computing, Continuous Delivery, Cloud api, Agile Software Development",Introduction to Blockchain; Cryptography Basics; Consensus Algorithms; Smart Contracts; Cryptocurrency; Blockchain Applications in Industry,0
"Distributed Computing, Business modeling, Open Source Technology, Emerging technology, Fintech, Scalability, Cryptography, Ledgers (Accounting), Encryption, Blockchain, Transaction Processing, Interoperability, Digital Assets",Data Security and Integrity; Vulnerabilities; Resource Protection; Private & Public Key Cryptography; Authentication; Network and Web Security;,0
"Incident Response, Threat Detection, Threat Modeling, Cyber Operations, Network Monitoring, Cybersecurity, Event Monitoring, Automation, Cyber Attacks, Security Management, Computer Security Incident Management, Security Information and Event Management (SIEM)",Introduction to Databases; Data Models; Entity-Relationship Model; Relational Model; SQL Basics; Advanced SQL; Database Normalization; Database Design; Transactions and Concurrency Control; Database Security,0
"Generative AI, Human Centered Design, Algorithms, Artificial Intelligence, Human Computer Interaction, Human Factors, Machine Learning, Ethical Standards And Conduct, Machine Learning Algorithms, Research Methodologies, Reinforcement Learning, Data Ethics, Artificial Neural Networks, Qualitative Research",Introduction to machine learning and artificial intelligence; Regression; Clustering; Non-ANN classifiers; ANN classifiers; Back-propagation algorithms; PCA for data reduction; Deep learning; ANN-based recognition system design,1
"Amazon CloudWatch, Scalability, Amazon Web Services, Cloud Computing, Cloud Security, Cloud Platforms, AWS Identity and Access Management (IAM), Amazon elastic compute clouds, Cloud infrastructure, Cloud Storage, Continuous Monitoring, Amazon S3, Public Cloud",Introduction to Blockchain; Cryptography Basics; Consensus Algorithms; Smart Contracts; Cryptocurrency; Blockchain Applications in Industry,0
"Capital Markets, Investments, Banking Services, Asset Management, Investment management, Point of Sale, Wealth Management, Payment Systems, Credit/Debit Card Processing, Mobile Banking, Credit Risk, Market Dynamics",Introduction to Databases; Data Models; Entity-Relationship Model; Relational Model; SQL Basics; Advanced SQL; Database Normalization; Database Design; Transactions and Concurrency Control; Database Security,0
"Product Planning, ChatGPT, Product Roadmaps, Product Testing, Prompt Engineering, Business Development, Product Development, Innovation, Generative AI, New Product Development, Stakeholder Engagement, Artificial Intelligence",Introduction to Databases; Data Models; Entity-Relationship Model; Relational Model; SQL Basics; Advanced SQL; Database Normalization; Database Design; Transactions and Concurrency Control; Database Security,0
"IT Automation, Cloud Computing Architecture, Cloud Management, Software Architecture, Infrastructure as code (IAC), Cloud Computing, Data management, Amazon CloudWatch, AWS CloudFormation, Amazon S3, CI/CD, Software Development Life Cycle",Introduction to Databases; Data Models; Entity-Relationship Model; Relational Model; SQL Basics; Advanced SQL; Database Normalization; Database Design; Transactions and Concurrency Control; Database Security,0
"Workflow Management, ChatGPT, Machine Learning, Computer Science, Large Language Modeling, Prompt Engineering, Robotic Process Automation, Business Intelligence, IBM Cloud, Application Deployment, Generative AI, Deep Learning","Introduction to cloud computing concepts; Introduction to Virtualization, Hypervisor, Container; IaaS, PaaS and SaaS Service Models; Introduction to Azure, GCS, and AWS platforms; Introduction for scalability and reliability features; Virtualization, Hypervisor, Container; Open source applications for cloud computing platforms",0
"Python Programming, Data manipulation, Jupyter, Relational Databases, Databases, Query Languages, Stored Procedure, Data analysis, SQL, Transaction Processing, Pandas (Python Package)",Introduction to Databases; Data Models; Entity-Relationship Model; Relational Model; SQL Basics; Advanced SQL; Database Normalization; Database Design; Transactions and Concurrency Control; Database Security,1
"Data Collection, Database Design, Power BI, Microsoft Power Platform, SQL, Data Integration, Business Intelligence, Business Reporting, Data manipulation, Statistical Reporting, Data Visualization, Date storage",Introduction to Blockchain; Cryptography Basics; Consensus Algorithms; Smart Contracts; Cryptocurrency; Blockchain Applications in Industry,0
"ChatGPT, Software Engineering, API Gateway, JavaScript Frameworks, Image Analysis, Generative AI Agents, Prompt Engineering, Open Source Technology, Cloud Hosting, User interface (UI), Application Deployment, Generative AI",Introduction to machine learning and artificial intelligence; Regression; Clustering; Non-ANN classifiers; ANN classifiers; Back-propagation algorithms; PCA for data reduction; Deep learning; ANN-based recognition system design,1
"Data manipulation, Query Languages, Database Design, Relational Databases, Database Administration, SQL, Databases, Database Management Systems, Integrity data, Mysql",Introduction to machine learning and artificial intelligence; Regression; Clustering; Non-ANN classifiers; ANN classifiers; Back-propagation algorithms; PCA for data reduction; Deep learning; ANN-based recognition system design,0
"Unsupervised Learning, ChatGPT, Date Amount/Export, Flask (Web Framework), Large Language Modeling, Prompt Engineering, Keras (Neural Network Library), Regression Analysis, Data manipulation, Generative AI, Deep Learning, Data wrangling","Introduction to cloud computing concepts; Introduction to Virtualization, Hypervisor, Container; IaaS, PaaS and SaaS Service Models; Introduction to Azure, GCS, and AWS platforms; Introduction for scalability and reliability features; Virtualization, Hypervisor, Container; Open source applications for cloud computing platforms",0
"Electronic Medical Record, Clinical Data Management, Applied Machine Learning, Machine Learning, Unstructured Data, Health Systems, Health Technology, Feature Engineering, Clinical Research, Pharmaceuticals, Artificial Intelligence, Data mining",Data Security and Integrity; Vulnerabilities; Resource Protection; Private & Public Key Cryptography; Authentication; Network and Web Security;,0
"Unsupervised Learning, Date Amount/Export, Data Literacy, SQL, Data manipulation, Generative AI, Jupyter, Interactive data viewing, Data Visualization, Data wrangling, Exploratory data analysis, Dashboard",Introduction to machine learning and artificial intelligence; Regression; Clustering; Non-ANN classifiers; ANN classifiers; Back-propagation algorithms; PCA for data reduction; Deep learning; ANN-based recognition system design,0
"Technical Support, Package and Software Management, Applicant Tracking Systems, Cloud infrastructure, Computer Security, It infrastructure, TCP/IP, Information Systems Security, File Systems, Professional Development, Systems Administration, Microsoft Windows",Introduction to machine learning and artificial intelligence; Regression; Clustering; Non-ANN classifiers; ANN classifiers; Back-propagation algorithms; PCA for data reduction; Deep learning; ANN-based recognition system design,0
"Ethical Standards And Conduct, Computational Thinking, Algorithms, Data quality, Design Thinking, Computer Science, Creativity, Machine Learning, Artificial Intelligence","Introduction to cloud computing concepts; Introduction to Virtualization, Hypervisor, Container; IaaS, PaaS and SaaS Service Models; Introduction to Azure, GCS, and AWS platforms; Introduction for scalability and reliability features; Virtualization, Hypervisor, Container; Open source applications for cloud computing platforms",0
"Cloud Services, Cloud Hosting, Cloud Computing, Hybrid Cloud Computing, Cloud infrastructure, Infrastructure As A Service (IaaS), Serverless Computing, Cloud Technologies, DevOps, Cloud Computing Architecture, Cloud Development, Cloud Solutions, Cloud Platforms, Cloud Engineering, Cloud Storage, Cloud Security, Emerging technology, Cloud Management, Virtual machines, Cloud-Native Computing","Introduction to cloud computing concepts; Introduction to Virtualization, Hypervisor, Container; IaaS, PaaS and SaaS Service Models; Introduction to Azure, GCS, and AWS platforms; Introduction for scalability and reliability features; Virtualization, Hypervisor, Container; Open source applications for cloud computing platforms",1
"Key management, Business, Asset Management, Cybersecurity, Financial Market, Authentications, Digital Assets, Security Awareness, Security Management, Payment Systems, Accounting and Finance Software, Cryptography","Network Architecture and Topology, Network Protocols and Communications; OSI and TCP/IP Layer; Physical Layer, Data Link Layer, Ethernet Switching; Transport Layer, Application Layer; IPv4 Addressing; IPv6 Addressing; Subnetting; VLANs and Inter-VLAN Routing; EtherChannel; FHRP; DHCPv4; DHCPv6; LAN Security; Wireless LAN; Static Protocol Routing",0
"Machine Learning, RMMARKDOWN, R Programming, Statistical Hypothesis Testing, Shiny (R Package), Github, Regression Analysis, Data manipulation, Machine Learning Algorithms, Predictive Modeling, Data Visualization, Statistical Analysis",Data Security and Integrity; Vulnerabilities; Resource Protection; Private & Public Key Cryptography; Authentication; Network and Web Security;,1
"Quality Assessment, Applicant Tracking Systems, Backlogs, Agile methodology, Quality Management, Project management, Analysis requirements, Project Controls, Team Management, Project Scoping, Interview Skills, Agile Project Management",Introduction to Databases; Data Models; Entity-Relationship Model; Relational Model; SQL Basics; Advanced SQL; Database Normalization; Database Design; Transactions and Concurrency Control; Database Security,0
"Entrepreneurial Finance, Business Valuation, Investments, Excel formulas, Financial modeling, Financial Analysis, Financial Market, Entrepreneurship, Market data, Probability Distribution, Cryptography, Microsoft Excel","Introduction to cloud computing concepts; Introduction to Virtualization, Hypervisor, Container; IaaS, PaaS and SaaS Service Models; Introduction to Azure, GCS, and AWS platforms; Introduction for scalability and reliability features; Virtualization, Hypervisor, Container; Open source applications for cloud computing platforms",0
"Graphic Design, Logo Design, Creative Design, CAMPAIGN MANAGEMENT, Digital design, Content Creation, Social Media Content, Content Marketing, Visual Design, Content Strategy, Advertising, Generative AI","Introduction to cloud computing concepts; Introduction to Virtualization, Hypervisor, Container; IaaS, PaaS and SaaS Service Models; Introduction to Azure, GCS, and AWS platforms; Introduction for scalability and reliability features; Virtualization, Hypervisor, Container; Open source applications for cloud computing platforms",0
"Data Security, Data Literacy, Database Design, Excel formas, Databases, Data management, Data Migration, SQL, Date store, Business Intelligence, Data Architecture, Data Visualization","Introduction to cloud computing concepts; Introduction to Virtualization, Hypervisor, Container; IaaS, PaaS and SaaS Service Models; Introduction to Azure, GCS, and AWS platforms; Introduction for scalability and reliability features; Virtualization, Hypervisor, Container; Open source applications for cloud computing platforms",0
"Cloud Storage, Database Architecture and Administration, Cloud Computing Architecture, Cloud infrastructure, Containerization, Prompt Engineering, Identity and Access Management, Data Migration, Database Administration, Application Deployment, Database Management, Generative AI","Introduction to cloud computing concepts; Introduction to Virtualization, Hypervisor, Container; IaaS, PaaS and SaaS Service Models; Introduction to Azure, GCS, and AWS platforms; Introduction for scalability and reliability features; Virtualization, Hypervisor, Container; Open source applications for cloud computing platforms",1
"Decision Support Systems, Database Design, SQL, Business Intelligence, Business Reporting, Star scheme, Database Management, Interactive data viewing, Data Visualization, Database Management Systems, Dashboard, SAS (Software)",Data Security and Integrity; Vulnerabilities; Resource Protection; Private & Public Key Cryptography; Authentication; Network and Web Security;,0
"Computer Architecture, Systems Architecture, Microarchitecture, Performance Tuning, Hardware Architecture, Computer Engineering, Scalability, Operating systems, Distributed Computing, Computer Science","Network Architecture and Topology, Network Protocols and Communications; OSI and TCP/IP Layer; Physical Layer, Data Link Layer, Ethernet Switching; Transport Layer, Application Layer; IPv4 Addressing; IPv6 Addressing; Subnetting; VLANs and Inter-VLAN Routing; EtherChannel; FHRP; DHCPv4; DHCPv6; LAN Security; Wireless LAN; Static Protocol Routing",1
"Cloud Services, Cloud Hosting, Cloud Computing, Hybrid Cloud Computing, Cloud infrastructure, Infrastructure As A Service (IaaS), Serverless Computing, Cloud Technologies, DevOps, Cloud Computing Architecture, Cloud Development, Cloud Solutions, Cloud Platforms, Cloud Engineering, Cloud Storage, Cloud Security, Emerging technology, Cloud Management, Virtual machines, Cloud-Native Computing",Introduction to machine learning and artificial intelligence; Regression; Clustering; Non-ANN classifiers; ANN classifiers; Back-propagation algorithms; PCA for data reduction; Deep learning; ANN-based recognition system design,0
