course,target,label
"Applied Machine Learning, Machine Learning Methods, Engineering analysis, Image Analysis, Ui components, Programming Principles, Statistical Methods, Scripting, Mathematical Software, User interface (UI), Matlab, Engineering Calculations","Introduction to cloud computing concepts; Introduction to Virtualization, Hypervisor, Container; IaaS, PaaS and SaaS Service Models; Introduction to Azure, GCS, and AWS platforms; Introduction for scalability and reliability features; Virtualization, Hypervisor, Container; Open source applications for cloud computing platforms",0
"Application Security, Cybersecurity, Transaction Processing, Encryption, Security Engineering, Information Systems Security, Secure Coding, Network Security, Integrity data, Vulnerability Assessments, Blockchain, Cryptography","Introduction to cloud computing concepts; Introduction to Virtualization, Hypervisor, Container; IaaS, PaaS and SaaS Service Models; Introduction to Azure, GCS, and AWS platforms; Introduction for scalability and reliability features; Virtualization, Hypervisor, Container; Open source applications for cloud computing platforms",0
"Applied Machine Learning, Machine Learning, Image Analysis, Medical Imaging, Feature Engineering, Data mapping, Visualization (Computer Graphics), Motion Graphics, Data validation, Machine Learning Algorithms, Matlab, Deep Learning",Introduction to machine learning and artificial intelligence; Regression; Clustering; Non-ANN classifiers; ANN classifiers; Back-propagation algorithms; PCA for data reduction; Deep learning; ANN-based recognition system design,0
"Data Security, Cyber Attacks, Infrastructure Security, Governance, Authorization (Computing), Computer Security Awareness Training, Incident Response, Cybersecurity, Computer Security Incident Management, Risk Management Framework, Disaster Recovery, Role-Based Access Control (RBAC)","Introduction to cloud computing concepts; Introduction to Virtualization, Hypervisor, Container; IaaS, PaaS and SaaS Service Models; Introduction to Azure, GCS, and AWS platforms; Introduction for scalability and reliability features; Virtualization, Hypervisor, Container; Open source applications for cloud computing platforms",0
"Data Analysis Software, Data Analysis Expressions (DAX), Excel formas, Power BI, Infographics, Pivot Tables And Charts, Data validation, Data manipulation, Excel macros, Interactive data viewing, Data Visualization, Dashboard","Network Architecture and Topology, Network Protocols and Communications; OSI and TCP/IP Layer; Physical Layer, Data Link Layer, Ethernet Switching; Transport Layer, Application Layer; IPv4 Addressing; IPv6 Addressing; Subnetting; VLANs and Inter-VLAN Routing; EtherChannel; FHRP; DHCPv4; DHCPv6; LAN Security; Wireless LAN; Static Protocol Routing",0
"Cloud infrastructure, CI/CD, Serverless Computing, Github, Software Development Methodologies, Continuous Delivery, Cloud Computing, Infrastructure As A Service (IaaS), Agile Software Development, Software Development, Amazon Web Services, Platform As A Service (PaaS), Infrastructure as code (IAC), Technical Communication, DevOps","Network Architecture and Topology, Network Protocols and Communications; OSI and TCP/IP Layer; Physical Layer, Data Link Layer, Ethernet Switching; Transport Layer, Application Layer; IPv4 Addressing; IPv6 Addressing; Subnetting; VLANs and Inter-VLAN Routing; EtherChannel; FHRP; DHCPv4; DHCPv6; LAN Security; Wireless LAN; Static Protocol Routing",0
"Network Protocols, Endpoint Security, Zero Trust Network Access, Firewall, General Networking, Public Key Infrastructure, Network Infrastructure, Network Security, Encryption, Cryptography, Cybersecurity, TCP/IP",Introduction to machine learning and artificial intelligence; Regression; Clustering; Non-ANN classifiers; ANN classifiers; Back-propagation algorithms; PCA for data reduction; Deep learning; ANN-based recognition system design,0
"Intrusion Detection and Prevention, Cyber Attacks, Incident Response, Cybersecurity, Vulnerability Assessments, Computer Security Incident Management, SQL, Interview Skills, Harding, Bash (Scripting Language), Network Security, Threat Management",Introduction to Blockchain; Cryptography Basics; Consensus Algorithms; Smart Contracts; Cryptocurrency; Blockchain Applications in Industry,0
"Cloud Storage, Cloud Computing Architecture, Cloud infrastructure, Cloud Management, Containerization, Prompt Engineering, Infrastructure as code (IAC), Cloud Computing, Identity and Access Management, Terraform, Application Deployment, Kubernetes",Introduction to machine learning and artificial intelligence; Regression; Clustering; Non-ANN classifiers; ANN classifiers; Back-propagation algorithms; PCA for data reduction; Deep learning; ANN-based recognition system design,0
"Distributed Computing, Emerging technology, Governance, Cryptography, Stakeholder Management, Fintech, Integrity data, Financial Services, Innovation, Blockchain, Public Key Cryptography Standards (PKCS), Design",Introduction to Blockchain; Cryptography Basics; Consensus Algorithms; Smart Contracts; Cryptocurrency; Blockchain Applications in Industry,1
"Data Collection, Database Design, Power BI, Microsoft Power Platform, SQL, Data Integration, Business Intelligence, Business Reporting, Data manipulation, Statistical Reporting, Data Visualization, Date storage","Network Architecture and Topology, Network Protocols and Communications; OSI and TCP/IP Layer; Physical Layer, Data Link Layer, Ethernet Switching; Transport Layer, Application Layer; IPv4 Addressing; IPv6 Addressing; Subnetting; VLANs and Inter-VLAN Routing; EtherChannel; FHRP; DHCPv4; DHCPv6; LAN Security; Wireless LAN; Static Protocol Routing",0
"Data Security, Intrusion Detection and Prevention, Cyber Attacks, Software Design Patterns, Information Systems Security, Data Encryption Standard, Cybersecurity, Application Security, Risk Management Framework, Network Security, Penetration Testing, Secure Coding",Introduction to Databases; Data Models; Entity-Relationship Model; Relational Model; SQL Basics; Advanced SQL; Database Normalization; Database Design; Transactions and Concurrency Control; Database Security,0
"ChatGPT, Software Engineering, API Gateway, JavaScript Frameworks, Image Analysis, Generative AI Agents, Prompt Engineering, Open Source Technology, Cloud Hosting, User interface (UI), Application Deployment, Generative AI",Introduction to Blockchain; Cryptography Basics; Consensus Algorithms; Smart Contracts; Cryptocurrency; Blockchain Applications in Industry,0
"Cyber Attacks, Infrastructure Security, Computer Security, Data Encryption Standard, Cybersecurity, Cyber Security Policies, Authentications, Network Security, Network Architecture, Mobile Security, Cryptography, Firewall",Introduction to machine learning and artificial intelligence; Regression; Clustering; Non-ANN classifiers; ANN classifiers; Back-propagation algorithms; PCA for data reduction; Deep learning; ANN-based recognition system design,0
"Network Protocols, Networking hardware, Cloud Services, TCP/IP, General Networking, Microsoft Windows, Cloud Storage, Local Area Networks, Computer Networking, Command-Line Interface, Wireless Networks, Data Storage, Network Administration, Network Infrastructure, Network Troubleshooting, Data Storage Technologies, Network Architecture",Introduction to Blockchain; Cryptography Basics; Consensus Algorithms; Smart Contracts; Cryptocurrency; Blockchain Applications in Industry,0
"Cloud Storage, Cloud Computing Architecture, Cloud infrastructure, Network Monitoring, Network Routing, Containerization, Virtual Private Networks (VPN), Prompt Engineering, Identity and Access Management, System Monitoring, Network Troubleshooting, Application Performance Management",Introduction to machine learning and artificial intelligence; Regression; Clustering; Non-ANN classifiers; ANN classifiers; Back-propagation algorithms; PCA for data reduction; Deep learning; ANN-based recognition system design,0
"Emerging technology, Virtual reality, Virtual Environment, Blockchain, Digital Assets, Research and Design, Augmented and Virtual Reality (AR/VR), Augmented Reality, E-Commerce, New Product Development, Safety and Security, Collaborative Software, Social Studies, Healthcare Ethics, Content Creation, Diversity and Inclusion, Economic Development","Introduction to cloud computing concepts; Introduction to Virtualization, Hypervisor, Container; IaaS, PaaS and SaaS Service Models; Introduction to Azure, GCS, and AWS platforms; Introduction for scalability and reliability features; Virtualization, Hypervisor, Container; Open source applications for cloud computing platforms",0
"Cloud Computing, Identity and Access Management, Generative AI, Application Deployment, Cloud Storage, Nosql, Application Development, Virtual machines, Network Infrastructure, Scalability, Google Cloud Platform, Cloud infrastructure, Cloud Services, Prompt Engineering, Kubernetes, Containerization",Introduction to Blockchain; Cryptography Basics; Consensus Algorithms; Smart Contracts; Cryptocurrency; Blockchain Applications in Industry,0
"Routing Protocols, System Programming, Network Routing, TCP/IP, Telecommunications, Digital Communications, Integrity data, Network Infrastructure, Network Planning And Design, Network Performance Management, Network Security, Wireless Networks","Introduction to cloud computing concepts; Introduction to Virtualization, Hypervisor, Container; IaaS, PaaS and SaaS Service Models; Introduction to Azure, GCS, and AWS platforms; Introduction for scalability and reliability features; Virtualization, Hypervisor, Container; Open source applications for cloud computing platforms",0
"User Accounts, Database Management, Database Architecture and Administration, Mysql, Database Administration, Operational Databases, Database Systems, Performance Tuning, Database Design, PostgreSQL, Encryption, Role-Based Access Control (RBAC), Data Storage Technologies, Relational Databases, System Monitoring, Disaster Recovery, IBM DB2",Introduction to machine learning and artificial intelligence; Regression; Clustering; Non-ANN classifiers; ANN classifiers; Back-propagation algorithms; PCA for data reduction; Deep learning; ANN-based recognition system design,0
"ChatGPT, Software Engineering, API Gateway, JavaScript Frameworks, Image Analysis, Generative AI Agents, Prompt Engineering, Open Source Technology, Cloud Hosting, User interface (UI), Application Deployment, Generative AI",Introduction to Databases; Data Models; Entity-Relationship Model; Relational Model; SQL Basics; Advanced SQL; Database Normalization; Database Design; Transactions and Concurrency Control; Database Security,0
"Probability & Statistics, Supervised Learning, Decision Tree Learning, Machine Learning Algorithms, Decision Support Systems, Complex Problem Solving, Text Mining, Artificial Intelligence and Machine Learning (AI/ML), Artificial Intelligence, Bayesian Statistics, Information Architecture, Machine Learning, Natural Language Processing, Taxonomy, Business strategy, Game Design, Strategic Thinking, Algorithms, Computational Logic, Strategic Decision-Making",Introduction to Databases; Data Models; Entity-Relationship Model; Relational Model; SQL Basics; Advanced SQL; Database Normalization; Database Design; Transactions and Concurrency Control; Database Security,0
"Data Security, Data Analysis Software, Record Keeping, TCP/IP, Information Systems Security, File Systems, Integrity data, Cybersecurity, Microsoft Windows, USB, System Configuration, General Networking",Data Security and Integrity; Vulnerabilities; Resource Protection; Private & Public Key Cryptography; Authentication; Network and Web Security;,0
"Computer Programming Tools, Cryptographic Protocols, Data Structures, Debugging, Programming Principles, Secure Coding, Program Development, Application Development, Other Programming Languages, Emerging technology, Blockchain, Fintech, Digital Assets",Introduction to Databases; Data Models; Entity-Relationship Model; Relational Model; SQL Basics; Advanced SQL; Database Normalization; Database Design; Transactions and Concurrency Control; Database Security,0
"Predictive Analytics, Analytics, Database Design, Information Systems, Databases, SQL, Date store, Business Intelligence, Database Management, Big data, Mongodb, Date modeling","Introduction to cloud computing concepts; Introduction to Virtualization, Hypervisor, Container; IaaS, PaaS and SaaS Service Models; Introduction to Azure, GCS, and AWS platforms; Introduction for scalability and reliability features; Virtualization, Hypervisor, Container; Open source applications for cloud computing platforms",0
"Cloud Computing Architecture, Governance, Incident Response, Cybersecurity, Application Security, Computer Security Incident Management, Network Troubleshooting, Disaster Recovery, Network Security, Penetration Testing, Virtualization, Information Technology",Introduction to Databases; Data Models; Entity-Relationship Model; Relational Model; SQL Basics; Advanced SQL; Database Normalization; Database Design; Transactions and Concurrency Control; Database Security,0
"Database Architecture and Administration, Databases, Date modeling, SQL, Distributed Computing, Database Design, Nosql, Data manipulation, Transaction Processing, Performance Tuning, Mysql, Database Management Systems, Big data, Relational Databases","Introduction to cloud computing concepts; Introduction to Virtualization, Hypervisor, Container; IaaS, PaaS and SaaS Service Models; Introduction to Azure, GCS, and AWS platforms; Introduction for scalability and reliability features; Virtualization, Hypervisor, Container; Open source applications for cloud computing platforms",0
"Security Engineering, Intrusion Detection and Prevention, Computer Security, Network Monitoring, Network Routing, Network Administration, Virtual Private Networks (VPN), Cybersecurity, Application Security, Network Infrastructure, Authentications, Network Troubleshooting",Introduction to machine learning and artificial intelligence; Regression; Clustering; Non-ANN classifiers; ANN classifiers; Back-propagation algorithms; PCA for data reduction; Deep learning; ANN-based recognition system design,0
"Workflow Management, MLOps (Machine Learning Operations), Unsupervised Learning, Goal Setting, Applied Machine Learning, Data Collection, Linear algebra, Random Forest Algorithm, Productivity, Learning Strategies, Regression Analysis, Machine Learning Algorithms","Introduction to cloud computing concepts; Introduction to Virtualization, Hypervisor, Container; IaaS, PaaS and SaaS Service Models; Introduction to Azure, GCS, and AWS platforms; Introduction for scalability and reliability features; Virtualization, Hypervisor, Container; Open source applications for cloud computing platforms",0
"Mysql, Stored Procedure, Database Management, Data Structures, Transaction Processing, SQL, Integrity data, Performance Tuning, Database Design, Java, Database Development, Relational Databases","Introduction to cloud computing concepts; Introduction to Virtualization, Hypervisor, Container; IaaS, PaaS and SaaS Service Models; Introduction to Azure, GCS, and AWS platforms; Introduction for scalability and reliability features; Virtualization, Hypervisor, Container; Open source applications for cloud computing platforms",0
"Person (User Experience), Applicant Tracking Systems, Cross Platform Development, Information Architecture, User Story, Responsive Web Design, Wireframing, User Research, Design Reviews, Presentations, User Experience Design, Figma (Design Software)","Network Architecture and Topology, Network Protocols and Communications; OSI and TCP/IP Layer; Physical Layer, Data Link Layer, Ethernet Switching; Transport Layer, Application Layer; IPv4 Addressing; IPv6 Addressing; Subnetting; VLANs and Inter-VLAN Routing; EtherChannel; FHRP; DHCPv4; DHCPv6; LAN Security; Wireless LAN; Static Protocol Routing",1
"Network Security, Security Engineering, Blockchain, Integrity data, Cryptography, Algorithms, Distributed Computing, Threat Modeling, Transaction Processing, Scalability",Introduction to Blockchain; Cryptography Basics; Consensus Algorithms; Smart Contracts; Cryptocurrency; Blockchain Applications in Industry,1
"Security Engineering, Intrusion Detection and Prevention, Computer Security, Network Monitoring, Network Routing, Network Administration, Virtual Private Networks (VPN), Cybersecurity, Application Security, Network Infrastructure, Authentications, Network Troubleshooting",Introduction to Databases; Data Models; Entity-Relationship Model; Relational Model; SQL Basics; Advanced SQL; Database Normalization; Database Design; Transactions and Concurrency Control; Database Security,0
"Load balancing, Data Security, Scalability, Cloud Storage, Data Storage Technologies, Cloud infrastructure, Server, Cloud Computing Architecture, Database Management, Cloud Security, Cloud Computing, Encryption, Relational Databases",Introduction to machine learning and artificial intelligence; Regression; Clustering; Non-ANN classifiers; ANN classifiers; Back-propagation algorithms; PCA for data reduction; Deep learning; ANN-based recognition system design,0
"Data Security, Apache Kafka, Linux Commands, Database Design, Pipelines data, Data Migration, SQL, Date store, Database Administration, Database Management, Bash (scripting language), Date Architecture",Introduction to Databases; Data Models; Entity-Relationship Model; Relational Model; SQL Basics; Advanced SQL; Database Normalization; Database Design; Transactions and Concurrency Control; Database Security,1
"Unstructured Data, Cloud infrastructure, Organizational Strategy, Generative AI Agents, Large Language Modeling, Prompt Engineering, Cloud Computing, Data management, Collaboration, Innovation, Cloud Solutions, Generative AI","Introduction to cloud computing concepts; Introduction to Virtualization, Hypervisor, Container; IaaS, PaaS and SaaS Service Models; Introduction to Azure, GCS, and AWS platforms; Introduction for scalability and reliability features; Virtualization, Hypervisor, Container; Open source applications for cloud computing platforms",0
"Encryption, Payment Systems, Data mining, Scripting, Cryptography, Distributed Computing, Network Protocols, Blockchain, Public Affairs, Emerging technology, Transaction Processing, Data Storage, Fintech, Digital Assets, Market Dynamics, Application Security","Network Architecture and Topology, Network Protocols and Communications; OSI and TCP/IP Layer; Physical Layer, Data Link Layer, Ethernet Switching; Transport Layer, Application Layer; IPv4 Addressing; IPv6 Addressing; Subnetting; VLANs and Inter-VLAN Routing; EtherChannel; FHRP; DHCPv4; DHCPv6; LAN Security; Wireless LAN; Static Protocol Routing",0
"Shell Script, Apache Kafka, IBM Cognos Analytics, Database Architecture and Administration, Linux Commands, Database Design, Pipelines data, SQL, Date store, Database Administration, Database Management, Bash (Scripting Language)",Introduction to Databases; Data Models; Entity-Relationship Model; Relational Model; SQL Basics; Advanced SQL; Database Normalization; Database Design; Transactions and Concurrency Control; Database Security,1
"Workflow Management, Data Analysis Expressions (DAX), Excel formas, Integrity data, Data management, Business Intelligence Software, Business Reporting, Data validation, Excel macros, Data Visualization, Dashboard, Date modeling",Introduction to Blockchain; Cryptography Basics; Consensus Algorithms; Smart Contracts; Cryptocurrency; Blockchain Applications in Industry,0
"Cloud Computing, Identity and Access Management, Generative AI, Application Deployment, Cloud Storage, Nosql, Application Development, Virtual machines, Network Infrastructure, Scalability, Google Cloud Platform, Cloud infrastructure, Cloud Services, Prompt Engineering, Kubernetes, Containerization",Introduction to machine learning and artificial intelligence; Regression; Clustering; Non-ANN classifiers; ANN classifiers; Back-propagation algorithms; PCA for data reduction; Deep learning; ANN-based recognition system design,0
"Database Design, Database Administration, Query Languages, Mysql, Databases, Database Management Systems, SQL, NoSQL, Relational Databases",Introduction to Blockchain; Cryptography Basics; Consensus Algorithms; Smart Contracts; Cryptocurrency; Blockchain Applications in Industry,0
"Data Security, Cyber Attacks, Infrastructure Security, Governance, Authorization (Computing), Computer Security Awareness Training, Incident Response, Cybersecurity, Computer Security Incident Management, Risk Management Framework, Disaster Recovery, Role-Based Access Control (RBAC)",Data Security and Integrity; Vulnerabilities; Resource Protection; Private & Public Key Cryptography; Authentication; Network and Web Security;,1
"Data Security, Apache Kafka, Linux Commands, Database Design, Pipelines data, Data Migration, SQL, Date store, Database Administration, Database Management, Bash (scripting language), Date Architecture","Introduction to cloud computing concepts; Introduction to Virtualization, Hypervisor, Container; IaaS, PaaS and SaaS Service Models; Introduction to Azure, GCS, and AWS platforms; Introduction for scalability and reliability features; Virtualization, Hypervisor, Container; Open source applications for cloud computing platforms",0
"Workflow Management, Data Analysis Expressions (DAX), Excel formas, Integrity data, Data management, Business Intelligence Software, Business Reporting, Data validation, Excel macros, Data Visualization, Dashboard, Date modeling","Introduction to cloud computing concepts; Introduction to Virtualization, Hypervisor, Container; IaaS, PaaS and SaaS Service Models; Introduction to Azure, GCS, and AWS platforms; Introduction for scalability and reliability features; Virtualization, Hypervisor, Container; Open source applications for cloud computing platforms",0
"Threat Detection, Security Management, Cyber Security Assessment, Cybersecurity, TCP/IP, Network Administration, General Networking, Virtual Private Networks (VPN), Wireless Networks, Cloud Computing, Network Security, Network Monitoring, Security Awareness, Network Protocols, Computer Networking, Firewall, System Monitoring, Cloud Security, Vulnerability Assessments, Intrusion Detection and Prevention",Introduction to Databases; Data Models; Entity-Relationship Model; Relational Model; SQL Basics; Advanced SQL; Database Normalization; Database Design; Transactions and Concurrency Control; Database Security,0
"Computer Networking, Cryptographic Protocols, Network Infrastructure, Threat Modeling, Network Architecture, OSI Models, Network Protocols, Vulnerability Assessments, Application Security, Network Security, Cybersecurity, TCP/IP",Introduction to Blockchain; Cryptography Basics; Consensus Algorithms; Smart Contracts; Cryptocurrency; Blockchain Applications in Industry,0
"Emerging technology, Openi, Market Intelligence, Market data, Supervised Learning, Artificial Intelligence and Machine Learning (AI/ML), Technology Strategies, Deep Learning, Machine Learning, Human Machine Interfaces, Applied Machine Learning, Artificial Intelligence, Business Ethics, Generative AI, Business, Ethical Standards And Conduct",Data Security and Integrity; Vulnerabilities; Resource Protection; Private & Public Key Cryptography; Authentication; Network and Web Security;,0
"MLOps (Machine Learning Operations), Unsupervised Learning, Applied Machine Learning, Infrastructure architecture, Cloud infrastructure, Generative AI Agents, Large Language Modeling, Prompt Engineering, Data management, Microsoft Azure, Application Deployment, Generative AI",Data Security and Integrity; Vulnerabilities; Resource Protection; Private & Public Key Cryptography; Authentication; Network and Web Security;,0
"Load balancing, Data Security, Scalability, Cloud Storage, Data Storage Technologies, Cloud infrastructure, Server, Cloud Computing Architecture, Database Management, Cloud Security, Cloud Computing, Encryption, Relational Databases",Introduction to Databases; Data Models; Entity-Relationship Model; Relational Model; SQL Basics; Advanced SQL; Database Normalization; Database Design; Transactions and Concurrency Control; Database Security,0
"Network Protocols, Endpoint Security, Zero Trust Network Access, Firewall, General Networking, Public Key Infrastructure, Network Infrastructure, Network Security, Encryption, Cryptography, Cybersecurity, TCP/IP",Data Security and Integrity; Vulnerabilities; Resource Protection; Private & Public Key Cryptography; Authentication; Network and Web Security;,1
"Query Languages, Pear review, Database Design, Text Mining, Business Analytics, Presentations, SQL, Apache Spark, Data Visualization, Statistical Analysis, Exploratory Data Analysis, Data Governance",Data Security and Integrity; Vulnerabilities; Resource Protection; Private & Public Key Cryptography; Authentication; Network and Web Security;,0
"Machine Learning, Linear algebra, Sampling (Statistics), Pseudocode, Machine Learning Algorithms, Deep Learning, Artificial Neural Networks, Reinforcement Learning, Probability Distribution, Artificial Intelligence, Supervised Learning, Mark's model",Introduction to machine learning and artificial intelligence; Regression; Clustering; Non-ANN classifiers; ANN classifiers; Back-propagation algorithms; PCA for data reduction; Deep learning; ANN-based recognition system design,1
"Image Analysis, Large Language Modeling, Content Creation, Virtual Environment, IBM Cloud, Artificial Intelligence, Business Ethics",Introduction to Databases; Data Models; Entity-Relationship Model; Relational Model; SQL Basics; Advanced SQL; Database Normalization; Database Design; Transactions and Concurrency Control; Database Security,0
